{
  "schema": "soma.avatar-rig-ir",
  "schema_version": "1.0.0",
  "rig_id": "vrm:tai.embodiment.vrm:c94075ebc079",
  "rig_signature": "sha256:6f372fe75c809b9384ea7b50e2f358b5de00804a5e8ff42a98d940ada7b43fe8",
  "source": {
    "format": "vrm",
    "format_version": "0",
    "asset_signature": "sha256:c94075ebc079fd5f010277f213d4ec4a299df46c9c44290562bb2189e4a16b46",
    "importer": "@pixiv/three-vrm",
    "importer_version": "3.0.0",
    "rig_space": "normalized",
    "basis_correction": "VRMUtils.rotateVRM0(scene-yaw-180)"
  },
  "coordinate_system": {
    "status": "declared",
    "handedness": "right",
    "up_axis": "+Y",
    "forward_axis": "-Z-scene-local-after-normalization",
    "linear_unit": "meter"
  },
  "bones": [
    {
      "id": "three:/Group[0]/VRMHumanoidRig[0]/Normalized_J_Bip_C_Hips[0]",
      "name": "Normalized_J_Bip_C_Hips",
      "parent_id": null,
      "semantic": "hips",
      "rest_local": {
        "position": [
          0,
          0.9430415,
          -0.00357606518
        ],
        "quaternion": [
          0,
          0,
          0,
          1
        ],
        "scale": [
          1,
          1,
          1
        ]
      },
      "rest_world": {
        "position": [
          -4.379416776229304e-19,
          0.9430415,
          0.00357606518
        ],
        "quaternion": [
          0,
          1,
          0,
          6.123233995736766e-17
        ],
        "scale": [
          1,
          1,
          1
        ]
      }
    },
    {
      "id": "three:/Group[0]/VRMHumanoidRig[0]/Normalized_J_Bip_C_Hips[0]/Normalized_J_Bip_C_Spine[0]",
      "name": "Normalized_J_Bip_C_Spine",
      "parent_id": "three:/Group[0]/VRMHumanoidRig[0]/Normalized_J_Bip_C_Hips[0]",
      "semantic": "spine",
      "rest_local": {
        "position": [
          6.20287151e-32,
          0.05158597229999995,
          -0.012400853399999998
        ],
        "quaternion": [
          0,
          0,
          0,
          1
        ],
        "scale": [
          1,
          1,
          1
        ]
      },
      "rest_world": {
        "position": [
          -1.9566082199235493e-18,
          0.9946274722999999,
          0.01597691858
        ],
        "quaternion": [
          0,
          1,
          0,
          6.123233995736766e-17
        ],
        "scale": [
          1,
          1,
          1
        ]
      }
    },
    {
      "id": "three:/Group[0]/VRMHumanoidRig[0]/Normalized_J_Bip_C_Hips[0]/Normalized_J_Bip_C_Spine[0]/Normalized_J_Bip_C_Chest[0]",
      "name": "Normalized_J_Bip_C_Chest",
      "parent_id": "three:/Group[0]/VRMHumanoidRig[0]/Normalized_J_Bip_C_Hips[0]/Normalized_J_Bip_C_Spine[0]",
      "semantic": "chest",
      "rest_local": {
        "position": [
          -2.10101212e-17,
          0.11196052999999995,
          -0.0030214451300000014
        ],
        "quaternion": [
          0,
          0,
          0,
          1
        ],
        "scale": [
          1,
          1,
          1
        ]
      },
      "rest_world": {
        "position": [
          1.8683492669351065e-17,
          1.1065880022999999,
          0.01899836371
        ],
        "quaternion": [
          0,
          1,
          0,
          6.123233995736766e-17
        ],
        "scale": [
          1,
          1,
          1
        ]
      }
    },
    {
      "id": "three:/Group[0]/VRMHumanoidRig[0]/Normalized_J_Bip_C_Hips[0]/Normalized_J_Bip_C_Spine[0]/Normalized_J_Bip_C_Chest[0]/Normalized_J_Bip_C_UpperChest[0]",
      "name": "Normalized_J_Bip_C_UpperChest",
      "parent_id": "three:/Group[0]/VRMHumanoidRig[0]/Normalized_J_Bip_C_Hips[0]/Normalized_J_Bip_C_Spine[0]/Normalized_J_Bip_C_Chest[0]",
      "semantic": "upperChest",
      "rest_local": {
        "position": [
          3.03259765e-17,
          0.10664153099999996,
          0.0145102357
        ],
        "quaternion": [
          0,
          0,
          0,
          1
        ],
        "scale": [
          1,
          1,
          1
        ]
      },
      "rest_world": {
        "position": [
          -9.865492460161068e-18,
          1.2132295332999998,
          0.00448812801
        ],
        "quaternion": [
          0,
          1,
          0,
          6.123233995736766e-17
        ],
        "scale": [
          1,
          1,
          1
        ]
      }
    },
    {
      "id": "three:/Group[0]/VRMHumanoidRig[0]/Normalized_J_Bip_C_Hips[0]/Normalized_J_Bip_C_Spine[0]/Normalized_J_Bip_C_Chest[0]/Normalized_J_Bip_C_UpperChest[0]/Normalized_J_Bip_C_Neck[0]",
      "name": "Normalized_J_Bip_C_Neck",
      "parent_id": "three:/Group[0]/VRMHumanoidRig[0]/Normalized_J_Bip_C_Hips[0]/Normalized_J_Bip_C_Spine[0]/Normalized_J_Bip_C_Chest[0]/Normalized_J_Bip_C_UpperChest[0]",
      "semantic": "neck",
      "rest_local": {
        "position": [
          9.51735352e-17,
          0.1310563090000001,
          0.0379991159
        ],
        "quaternion": [
          0,
          0,
          0,
          1
        ],
        "scale": [
          1,
          1,
          1
        ]
      },
      "rest_world": {
        "position": [
          -1.0038547809442464e-16,
          1.3442858423,
          -0.033510987889999996
        ],
        "quaternion": [
          0,
          1,
          0,
          6.123233995736766e-17
        ],
        "scale": [
          1,
          1,
          1
        ]
      }
    },
    {
      "id": "three:/Group[0]/VRMHumanoidRig[0]/Normalized_J_Bip_C_Hips[0]/Normalized_J_Bip_C_Spine[0]/Normalized_J_Bip_C_Chest[0]/Normalized_J_Bip_C_UpperChest[0]/Normalized_J_Bip_C_Neck[0]/Normalized_J_Bip_C_Head[0]",
      "name": "Normalized_J_Bip_C_Head",
      "parent_id": "three:/Group[0]/VRMHumanoidRig[0]/Normalized_J_Bip_C_Hips[0]/Normalized_J_Bip_C_Spine[0]/Normalized_J_Bip_C_Chest[0]/Normalized_J_Bip_C_UpperChest[0]/Normalized_J_Bip_C_Neck[0]",
      "semantic": "head",
      "rest_local": {
        "position": [
          4.01095868e-9,
          0.07479774999999989,
          -0.00949696451
        ],
        "quaternion": [
          0,
          0,
          0,
          1
        ],
        "scale": [
          1,
          1,
          1
        ]
      },
      "rest_world": {
        "position": [
          -4.01095878154852e-9,
          1.4190835922999998,
          -0.024014023379999996
        ],
        "quaternion": [
          0,
          1,
          0,
          6.123233995736766e-17
        ],
        "scale": [
          1,
          1,
          1
        ]
      }
    },
    {
      "id": "three:/Group[0]/VRMHumanoidRig[0]/Normalized_J_Bip_C_Hips[0]/Normalized_J_Bip_C_Spine[0]/Normalized_J_Bip_C_Chest[0]/Normalized_J_Bip_C_UpperChest[0]/Normalized_J_Bip_C_Neck[0]/Normalized_J_Bip_C_Head[0]/Normalized_J_Adj_L_FaceEye[0]",
      "name": "Normalized_J_Adj_L_FaceEye",
      "parent_id": "three:/Group[0]/VRMHumanoidRig[0]/Normalized_J_Bip_C_Hips[0]/Normalized_J_Bip_C_Spine[0]/Normalized_J_Bip_C_Chest[0]/Normalized_J_Bip_C_UpperChest[0]/Normalized_J_Bip_C_Neck[0]/Normalized_J_Bip_C_Head[0]",
      "semantic": "leftEye",
      "rest_local": {
        "position": [
          -0.0144238742,
          0.055630922299999996,
          -0.0220434964
        ],
        "quaternion": [
          0,
          0,
          0,
          1
        ],
        "scale": [
          1,
          1,
          1
        ]
      },
      "rest_world": {
        "position": [
          0.014423870189041215,
          1.4747145145999998,
          -0.001970526979999991
        ],
        "quaternion": [
          0,
          1,
          0,
          6.123233995736766e-17
        ],
        "scale": [
          1,
          1,
          1
        ]
      }
    },
    {
      "id": "three:/Group[0]/VRMHumanoidRig[0]/Normalized_J_Bip_C_Hips[0]/Normalized_J_Bip_C_Spine[0]/Normalized_J_Bip_C_Chest[0]/Normalized_J_Bip_C_UpperChest[0]/Normalized_J_Bip_C_Neck[0]/Normalized_J_Bip_C_Head[0]/Normalized_J_Adj_R_FaceEye[0]",
      "name": "Normalized_J_Adj_R_FaceEye",
      "parent_id": "three:/Group[0]/VRMHumanoidRig[0]/Normalized_J_Bip_C_Hips[0]/Normalized_J_Bip_C_Spine[0]/Normalized_J_Bip_C_Chest[0]/Normalized_J_Bip_C_UpperChest[0]/Normalized_J_Bip_C_Neck[0]/Normalized_J_Bip_C_Head[0]",
      "semantic": "rightEye",
      "rest_local": {
        "position": [
          0.0144238593,
          0.055630922299999996,
          -0.0220434964
        ],
        "quaternion": [
          0,
          0,
          0,
          1
        ],
        "scale": [
          1,
          1,
          1
        ]
      },
      "rest_world": {
        "position": [
          -0.014423863310958785,
          1.4747145145999998,
          -0.001970526979999998
        ],
        "quaternion": [
          0,
          1,
          0,
          6.123233995736766e-17
        ],
        "scale": [
          1,
          1,
          1
        ]
      }
    },
    {
      "id": "three:/Group[0]/VRMHumanoidRig[0]/Normalized_J_Bip_C_Hips[0]/Normalized_J_Bip_C_Spine[0]/Normalized_J_Bip_C_Chest[0]/Normalized_J_Bip_C_UpperChest[0]/Normalized_J_Bip_L_Shoulder[0]",
      "name": "Normalized_J_Bip_L_Shoulder",
      "parent_id": "three:/Group[0]/VRMHumanoidRig[0]/Normalized_J_Bip_C_Hips[0]/Normalized_J_Bip_C_Spine[0]/Normalized_J_Bip_C_Chest[0]/Normalized_J_Bip_C_UpperChest[0]",
      "semantic": "leftShoulder",
      "rest_local": {
        "position": [
          -0.0216970462,
          0.10470211500000004,
          0.029689826100000004
        ],
        "quaternion": [
          0,
          0,
          0,
          1
        ],
        "scale": [
          1,
          1,
          1
        ]
      },
      "rest_world": {
        "position": [
          0.021697046199999993,
          1.3179316482999999,
          -0.025201698090000002
        ],
        "quaternion": [
          0,
          1,
          0,
          6.123233995736766e-17
        ],
        "scale": [
          1,